id,domain,component,description,severity,dependencies,effort_estimate,proposed_solution
TRN-001,transport_L4,TLS/mTLS Support,جميع الـ Transporters (TCP,UDS,WebSocket,Subprocess) يرسلون نصًا بدون تشفير — الميزة مطلوبة لـ Gateway Mode و inter-container traffic,High,,M,إضافة ssl_context معامل إلى BaseTransporter.__init__() وتعديل TCPTransporter و UDSTransporter و WebSocketTransporter لاستخدام asyncio.start_server/TLS مع wrap_socket
TRN-002,transport_L4,Transport-Level Backpressure,لا توجد آلية للحد من معدل الإرسال عند ازدحام المتلقي — buffer قد ينفجر في الذاكرة أثناء التحميل الثقيل خاصًة مع التسلسل الهرمي (Composite -> multiple children),High,,L,إضافة BackpressureStrategy إلى TransportConfig مع throttle/callback/pause-resume بناءً على buffer_size أو ack latency; تطبيق حدود على asyncio.Queue في _merge_parallel_streams
TRN-003,transport_L4,TCP/UDS Keep-Alive Heartbeat,WSKeepAlivePolicy موجود في _ws_keepalive.py لـ WebSocketTransporter — لكن TCPTransporter و UDSTransporter لا يملكان أي آلية heartbeat; قد تُغلق اتصالات TCP الطويلة من قبل kernel/proxy صامتًا,Medium,TRN-001,S,إضافة setsockopt لتفعيل TCP_KEEPALIVE + TCP_KEEPIDLE/TCP_KEEPINTVL; أو إضافة HeartbeatConfig اختياري لـ BaseTransporter; UDS يحتاج حلًا خاصًا (إطارات ping بسيطة)
TRN-004,transport_L4,Zero-Copy Large Payload Handler,كل بايت يمر عبر serialize->compress->channel وعكسه — لا يوجد memory-mapped أو file descriptor passing للحمولات الكبيرة (ملفات أكبر من 100MB تستهلك ذاكرة مضاعفة),Medium,,L,إضافة LargePayloadHandler optional يكتشف >threshold ويكتب/يقرأ من temporary file أو mmap بدلاً من RAM; تمرير file descriptor عبر UDS كحل فوري لنفس الجهاز
TRN-005,transport_L4,Transporter Unit Tests,TCPTransporter و UDSTransporter و InProcessTransporter و SubprocessTransporter و WebSocketTransporter — دوال send()/stream()/serve()/close() لم تُختبر أبدًا (خطر runtime errors عند أول استخدام فعلي),High,TST-001,L,إنشاء unit tests لكل Transporter مع mock socket/asyncio streams; اختبار connect/fail/retry/close لكل نوع; اختبار WebSocketTransporter مع HTTP upgrade mocking
TRN-006,transport_L4,CompositeTransporter Tests,CompositeTransporter موصول في factory.py via _build_composite() لكنه غير مختبر وليس مستخدم في أي pipeline فعلي,Low,TST-001,S,كتابة اختبار يثبت أن CompositeTransporter يوجّه بشكل صحيح لـ sub-transporters ويعزل الأخطاء; اختبار FALLBACK/PARALLEL/BROADCAST لكل استراتيجية
TRN-007,transport_L4,RetryEngine Wiring (RESOLVED),RetryEngine مولف فعليًا مع جميع الـ Transporters: TCP/UDS/InProcess/Subprocess/WebSocket كلها تتحقق من self.retry_engine في send()/stream() وتمرره عبر __init__; الـ factory تنشئ RetryEngine دائمًا,resolved,,,تم حل المشقة — لا يتطلب تغيير
TRN-011,transport_L4,SubprocessTransporter serve() for INBOUND,SubprocessTransporter لا ينفذ serve() — @abstractmethod من BaseTransporter يمنع instantiation بالكامل (وليس فقط INBOUND). BaseTransporter.serve() معرف كـ abstractmethod فـ SubprocessTransporter() سيرفع TypeError,High,,S,إضافة serve() إلى SubprocessTransporter يقرأ من stdin بشكل مستمر ويعيد الردود على stdout — نمط process-per-request أو process-pool مع keep-alive
TRN-012,transport_L4,WebSocketTransporter Public Export,transport/__init__.py لا يصدر WebSocketTransporter ولا WSKeepAlivePolicy ولا WSFramingEngine — رغم أنهم موجودون في websocket.py. الـ factory يستوردهم مباشرة (import داخل الدالة),Medium,,S,إضافة WebSocketTransporter و WSKeepAlivePolicy و WSFramingEngine إلى __init__.py و __all__
