OSI_Layer,Cloudflare_Definition,OSI_Model_Layer_Component,CLI_Equivalent,InProcess_Equivalent,A2A_Equivalent,Status,Source_Type,External_Lib_Framework,Template_Config_Standard,Inbound_Role,Outbound_Role
L4,Transport - end-to-end segments flow/error control,RetryEngine (L4 Retry with Config + Backoff),RetryEngine wraps subprocess send with retries for transient errors,RetryEngine wraps in-process call with retries for transient exceptions,RetryEngine wraps TCP/UDS/HTTP sends with retries and backoff, Built - transporters/retry.py,Build,[Custom] uses asyncio,RetryEngine(retryable_errors, max_attempts, base_delay, max_delay, backoff) -> run(coro) -> result or raise,Inbound: not used inbound,Outbound: RetryEngine.run() wraps transporter send(); retries on TRANSIENT TransportError with exponential backoff
L4,Transport - end-to-end segments flow/error control,Composite Transporter (Multi-Transport Routing),N/A - CLI single-channel,N/A - InProcess single-call,CompositeTransporter with ROUTE/BROADCAST/SELECT for multi-channel routing, Built - transporters/composite.py,Build,[Custom] pure Python,BaseTransporter ABC -> CompositeTransporter: transporters list + CompositeStrategy (ROUTE / BROADCAST / SELECT),Inbound: Distributes incoming across multiple handlers (load balance / fan-out),Outbound: ROUTE sends to specific transport; BROADCAST to all; SELECT picks first available
L4,Transport - end-to-end segments flow/error control,Channel Config + TransportFactory,ChannelConfig defines transport type, host, port, timeout, retry,Settings per transport protocol.,Settings per transport protocol.,TransportFactory creates Channel from TransportConfig for any protocol, Built - transporters/config/ (transport_config.py + __init__.py) + transporters/factory.py,Build,[Custom],TransportConfig(protocol, host, port, timeout, retry, ...) + TransportFactory.create_channel(config) -> IChannel,Inbound: factory creates IChannel for inbound listener; configured via YAML,Outbound: factory creates IChannel for outbound connection; configured via YAML
L4,Transport - end-to-end segments flow/error control,Transport Provider Factory (wiring/factories/transport_provider.py),Not wired - raises NotImplementedError,Not wired - raises NotImplementedError,Not wired - needs to build channels per protocol config, Empty file - 0 bytes,Build,[Custom] + YAML config,Not yet defined (expected: build_channel(cfg) -> IChannel or build_channel_pool(cfg) -> IChannelPool),Inbound: Expected to create inbound IChannel for listening,Outbound: Expected to create outbound IChannel for connecting
L3,Network - packets routing service discovery,Channel Contract (IChannelPool + ISessionRouter + IServiceResolver),IChannelPool manages subprocess channel pool,IChannelPool manages in-process channel pool,IChannelPool manages HTTP/TCP/UDS channel pool for A2A, Built - network/protocol.py (all 3 contracts defined),Adapter,[Custom] + typed Protocol classes,IChannelPool: acquire()/release(channel)/health_check()/close() + ISessionRouter: bind/unbind/resolve/select candidates + IServiceResolver: resolve(service, port)/refresh()/list_services(),Inbound: ChannelPool.acquire() returns IChannel for inbound connection; SessionRouter.bind(session_id, channel_ref) routes session to channel,Outbound: SessionRouter.resolve(session_id) -> IChannel; if not bound -> ChannelPool.acquire() + SessionRouter.bind()
L3,Network - packets routing service discovery,ILoadBalancerStrategy (Channel Selection Algorithms),RoundRobin selects among subprocess channels,RoundRobin selects among in-process callables,RoundRobin selects A2A channels; LeastActive selects least-loaded, Built - network/algorithms/ (round_robin.py + least_active.py),Adapter,[Custom],ILoadBalancerStrategy: select(candidates: List[ChannelRef]) -> Optional[ChannelRef] + implementations: RoundRobinStrategy (rotating index) / LeastActiveStrategy (min active_sessions),Inbound: load balancer not typically used inbound,Outbound: SessionRouterAdapter.select() calls strategy.select(healthy_candidates) to pick optimal channel
L3,Network - packets routing service discovery,AsyncChannelPool (IChannelPool Implementation),AsyncChannelPool asyncio.Queue-based pool for subprocess channels,AsyncChannelPool for in-process channels pool,AsyncChannelPool for network channels with max_size and idle_timeout, Built - network/adapters/pool_adapter.py,Build,asyncio (stdlib),AsyncChannelPool(config, max_size, idle_timeout) -> acquire() returns existing or creates new -> release() returns to pool -> health_check() evicts idle -> close() drains all,Inbound: pool accepts inbound channels; health_check closes stale ones,Outbound: pool provides channels for outbound requests; acquires on demand
L3,Network - packets routing service discovery,SessionRouterAdapter (ISessionRouter Implementation),SessionRouterAdapter maps session_id -> ChannelRef for CLI sessions,SessionRouterAdapter maps session_id -> ChannelRef for in-process sessions,SessionRouterAdapter maps session_id -> ChannelRef for A2A channels, Built - network/adapters/router_adapter.py,Build,[Custom],SessionRouterAdapter(strategy, channel_lookup) -> bind(session_id, ref)/unbind(session_id)/resolve(session_id)/select(candidates),Inbound: SessionRouterAdapter.bind() called when inbound session mapped to channel,Outbound: SessionRouterAdapter.resolve() called each outbound request to find bound channel
L3,Network - packets routing service discovery,AsyncCircuitBreaker (Resilience Pattern),CircuitBreaker protects CLI subprocess from cascade failures,CircuitBreaker protects in-process call loop,CircuitBreaker protects A2A channel pool from remote failures, Built - network/resilience/circuit_breaker.py,Build,[Custom],AsyncCircuitBreaker(failure_threshold, recovery_timeout, success_threshold) -> CLOSED/OPEN/HALF_OPEN states; wraps any async callable,Inbound: circuit breaker wraps pool.acquire() rejects fast when OPEN, protects from cascade failure,Outbound: circuit breaker wraps channel.send() fast-fails when remote service degraded
L3,Network - packets routing service discovery,Service Resolvers (DNS + Config),DNSResolver resolves hostname -> Endpoint list; ConfigResolver resolves static endpoints from YAML,ConfigResolver for local service endpoints,Both DNS and Config for A2A peer discovery, Built - network/adapters/ (dns_resolver.py + config_resolver.py),Adapter,dns.resolver (stdlib) + [Custom],IServiceResolver implementations: DNSResolver.resolve(name, port) -> List[Endpoint] + ConfigResolver.resolve(name, config) -> List[Endpoint],Inbound: not used inbound,Outbound: ServiceResolver.resolve(service_name) -> Endpoint list -> load balancer selects -> ChannelPool acquires to that endpoint
L3,Network - packets routing service discovery,Network Provider Factory (wiring/factories/network_provider.py),Not wired - raises NotImplementedError,Not wired - raises NotImplementedError,Not wired - needs to build pool + router + resolvers from config, Empty file - 0 bytes,Build,[Custom] + YAML config,Not yet defined (expected: build_channel_pool(cfg) -> IChannelPool + build_router(cfg, pool) -> SessionDispatcher + load_balancer strategy),Inbound: Expected to wire ChannelPool + SessionRouterAdapter + CircuitBreaker from YAML,Outbound: Expected to wire same components; load balancer selects optimal channel per request
L3,Network - packets routing service discovery,Transport Config Loader (wiring/config/loader.py),Reads YAML config for all CLI transport settings,Reads YAML config for in-process channel settings,Reads YAML config for A2A network settings, Empty file - 0 bytes,Build,PyYAML / strictyaml,load_config(path) -> Config object with sections: network / session / presentation / protocols / transport,Inbound: config loaded at startup provides channel settings for inbound listeners,Outbound: config provides outbound channel pool, retry, timeout, and protocol handler settings
